{
  "$schema": "https://json-schema.org/draft/2020-12/schema",
  "$id": "https://hacp.example/schemas/v0.2-draft/handoff-package.schema.json",
  "title": "HACP 0.2 Draft Handoff Package",
  "type": "object",
  "additionalProperties": false,
  "required": [
    "schemaVersion",
    "recordKind",
    "handoffPackageId",
    "authorityPacketId",
    "authorityPacketDigest",
    "createdAt",
    "expiresAt",
    "targetLabel",
    "transportProfile",
    "executionProfile",
    "boundaryNotice",
    "digest"
  ],
  "properties": {
    "schemaVersion": { "const": "hacp-0.2-draft" },
    "recordKind": { "const": "hacp.handoff_package" },
    "handoffPackageId": { "type": "string", "minLength": 1 },
    "authorityPacketId": { "type": "string", "minLength": 1 },
    "authorityPacketDigest": {
      "allOf": [
        { "$ref": "https://hacp.example/schemas/v0.2-draft/common-defs.schema.json#/$defs/digest" },
        { "properties": { "digestDomain": { "const": "authority_packet_v0.2" } } }
      ]
    },
    "createdAt": { "type": "string", "format": "date-time" },
    "expiresAt": { "type": "string", "format": "date-time" },
    "targetLabel": { "type": "string", "minLength": 1 },
    "transportProfile": { "$ref": "#/$defs/transportProfileRef" },
    "executionProfile": { "$ref": "#/$defs/executionProfileRef" },
    "decisionRuleSnapshot": {
      "$ref": "https://hacp.example/schemas/v0.2-draft/common-defs.schema.json#/$defs/decisionRuleReference"
    },
    "boundaryNotice": {
      "type": "object",
      "additionalProperties": false,
      "required": [
        "handoffDoesNotCreateAuthority",
        "requestedNextStepIsAdvisory",
        "humanDecisionRequiredForConsequentialChange"
      ],
      "properties": {
        "handoffDoesNotCreateAuthority": { "const": true },
        "requestedNextStepIsAdvisory": { "const": true },
        "humanDecisionRequiredForConsequentialChange": { "const": true }
      }
    },
    "digest": {
      "allOf": [
        { "$ref": "https://hacp.example/schemas/v0.2-draft/common-defs.schema.json#/$defs/digest" },
        { "properties": { "digestDomain": { "const": "handoff_package_v0.2" } } }
      ]
    }
  },
  "$defs": {
    "transportProfileRef": {
      "type": "object",
      "additionalProperties": false,
      "required": ["profileId", "profileVersion"],
      "properties": {
        "profileId": {
          "enum": [
            "manual_browser_upload_v0.2",
            "manual_filesystem_carry_v0.2",
            "owner_controlled_cli_v0.2",
            "automated_transport_v0.2"
          ]
        },
        "profileVersion": { "const": "v0.2-draft" }
      }
    },
    "executionProfileRef": {
      "type": "object",
      "additionalProperties": false,
      "required": ["profileId", "profileVersion"],
      "properties": {
        "profileId": {
          "enum": [
            "no_execution_passthrough_v0.2",
            "review_only_v0.2",
            "verify_only_v0.2",
            "local_workspace_bounded_v0.2"
          ]
        },
        "profileVersion": { "const": "v0.2-draft" }
      }
    }
  }
}
